============================= test session starts ==============================
platform darwin -- Python 3.12.4, pytest-8.4.2, pluggy-1.6.0
rootdir: /Users/borislavdzodzo/Desktop/Dev/ais-129-issues-found-when-running-main
configfile: pytest.ini
plugins: typeguard-4.4.4
collected 333 items / 5 errors

==================================== ERRORS ====================================
________ ERROR collecting tests/step13/test_step13_synthetic_guards.py _________
ImportError while importing test module '/Users/borislavdzodzo/Desktop/Dev/ais-129-issues-found-when-running-main/tests/step13/test_step13_synthetic_guards.py'.
Hint: make sure your test modules/packages have valid Python names.
Traceback:
../../../.pyenv/versions/3.12.4/lib/python3.12/importlib/__init__.py:90: in import_module
    return _bootstrap._gcd_import(name[level:], package, level)
           ^^^^^^^^^^^^^^^^^^^^^^^^^^^^^^^^^^^^^^^^^^^^^^^^^^^^
tests/step13/test_step13_synthetic_guards.py:5: in <module>
    from tests.step13_synthetic.test_step13_synthetic_regression import (
E   ModuleNotFoundError: No module named 'tests.step13_synthetic'
_______ ERROR collecting tests/step13/test_step13_synthetic_integrity.py _______
ImportError while importing test module '/Users/borislavdzodzo/Desktop/Dev/ais-129-issues-found-when-running-main/tests/step13/test_step13_synthetic_integrity.py'.
Hint: make sure your test modules/packages have valid Python names.
Traceback:
../../../.pyenv/versions/3.12.4/lib/python3.12/importlib/__init__.py:90: in import_module
    return _bootstrap._gcd_import(name[level:], package, level)
           ^^^^^^^^^^^^^^^^^^^^^^^^^^^^^^^^^^^^^^^^^^^^^^^^^^^^
tests/step13/test_step13_synthetic_integrity.py:5: in <module>
    from tests.step13_synthetic.test_step13_synthetic_regression import (
E   ModuleNotFoundError: No module named 'tests.step13_synthetic'
__ ERROR collecting tests/step13/test_step13_synthetic_post_consolidation.py ___
ImportError while importing test module '/Users/borislavdzodzo/Desktop/Dev/ais-129-issues-found-when-running-main/tests/step13/test_step13_synthetic_post_consolidation.py'.
Hint: make sure your test modules/packages have valid Python names.
Traceback:
../../../.pyenv/versions/3.12.4/lib/python3.12/importlib/__init__.py:90: in import_module
    return _bootstrap._gcd_import(name[level:], package, level)
           ^^^^^^^^^^^^^^^^^^^^^^^^^^^^^^^^^^^^^^^^^^^^^^^^^^^^
tests/step13/test_step13_synthetic_post_consolidation.py:9: in <module>
    from tests.step13_synthetic.test_step13_synthetic_regression import (
E   ModuleNotFoundError: No module named 'tests.step13_synthetic'
________ ERROR collecting tests/step13/test_step13_synthetic_shares.py _________
ImportError while importing test module '/Users/borislavdzodzo/Desktop/Dev/ais-129-issues-found-when-running-main/tests/step13/test_step13_synthetic_shares.py'.
Hint: make sure your test modules/packages have valid Python names.
Traceback:
../../../.pyenv/versions/3.12.4/lib/python3.12/importlib/__init__.py:90: in import_module
    return _bootstrap._gcd_import(name[level:], package, level)
           ^^^^^^^^^^^^^^^^^^^^^^^^^^^^^^^^^^^^^^^^^^^^^^^^^^^^
tests/step13/test_step13_synthetic_shares.py:7: in <module>
    from tests.step13_synthetic.test_step13_synthetic_regression import (
E   ModuleNotFoundError: No module named 'tests.step13_synthetic'
______ ERROR collecting tests/step34b/test_step34_dual_output_isolated.py ______
import file mismatch:
imported module 'test_step34_dual_output_isolated' has this __file__ attribute:
  /Users/borislavdzodzo/Desktop/Dev/ais-129-issues-found-when-running-main/tests/step34a/test_step34_dual_output_isolated.py
which is not the same as the test file we want to collect:
  /Users/borislavdzodzo/Desktop/Dev/ais-129-issues-found-when-running-main/tests/step34b/test_step34_dual_output_isolated.py
HINT: remove __pycache__ / .pyc files and/or use a unique basename for your test file modules
=============================== warnings summary ===============================
tests/common/test_utils.py:17
  /Users/borislavdzodzo/Desktop/Dev/ais-129-issues-found-when-running-main/tests/common/test_utils.py:17: PytestCollectionWarning: cannot collect test class 'TestDataManager' because it has a __init__ constructor (from: tests/common/test_utils.py)
    class TestDataManager:

../../../.pyenv/versions/global-env/lib/python3.12/site-packages/pandera/_pandas_deprecated.py:160
  /Users/borislavdzodzo/.pyenv/versions/global-env/lib/python3.12/site-packages/pandera/_pandas_deprecated.py:160: FutureWarning: Importing pandas-specific classes and functions from the
  top-level pandera module will be **removed in a future version of pandera**.
  If you're using pandera to validate pandas objects, we highly recommend updating
  your import:
  
  ```
  # old import
  import pandera as pa
  
  # new import
  import pandera.pandas as pa
  ```
  
  If you're using pandera to validate objects from other compatible libraries
  like pyspark or polars, see the supported libraries section of the documentation
  for more information on how to import pandera:
  
  https://pandera.readthedocs.io/en/stable/supported_libraries.html
  
  To disable this warning, set the environment variable:
  
  ```
  export DISABLE_PANDERA_IMPORT_WARNING=True
  ```
  
    warnings.warn(_future_warning, FutureWarning)

-- Docs: https://docs.pytest.org/en/stable/how-to/capture-warnings.html
=========================== short test summary info ============================
ERROR tests/step13/test_step13_synthetic_guards.py
ERROR tests/step13/test_step13_synthetic_integrity.py
ERROR tests/step13/test_step13_synthetic_post_consolidation.py
ERROR tests/step13/test_step13_synthetic_shares.py
ERROR tests/step34b/test_step34_dual_output_isolated.py
!!!!!!!!!!!!!!!!!!! Interrupted: 5 errors during collection !!!!!!!!!!!!!!!!!!!!
======================== 2 warnings, 5 errors in 1.06s =========================
